Article_type,PMID,Title,DP,Volume,Issue,Page,Doi,Abstract,Author,Affiliation
"['Journal Article', 'Research Support, N.I.H., Extramural', ""Research Support, Non-U.S. Gov't"", 'Review']",21945349,Emerging importance of ALK in neuroblastoma.,2011 Oct,21,4,267-75,10.1016/j.semcancer.2011.09.005 [doi],"Since the original descriptions of gain-of function mutations in anaplastic lymphoma kinase (ALK), interest in the role of this receptor tyrosine kinase in neuroblastoma development and as a potential therapeutic target has escalated. As a group, the activating point mutations in full-length ALK, found in approximately 8% of all neuroblastoma tumors, are distributed evenly across different clinical stages. However, the most frequent somatic mutation, F1174L, is associated with amplification of the MYCN oncogene. This combination of features appears to confer a worse prognosis than MYCN amplification alone, suggesting a cooperative effect on neuroblastoma formation by these two proteins. Indeed, F1174L has shown more potent transforming activity in vivo than the second most common activating mutation, R1275Q, and is responsible for innate and acquired resistance to crizotinib, a clinically relevant ALK inhibitor that will soon be commercially available. These advances cast ALK as a bona fide oncoprotein in neuroblastoma and emphasize the need to understand ALK-mediated signaling in this tumor. This review addresses many of the current issues surrounding the role of ALK in normal development and neuroblastoma pathogenesis, and discusses the prospects for clinically effective targeted treatments based on ALK inhibition.","['Azarova AM', 'Gautam G', 'George RE']","[""Department of Pediatric Hematology and Oncology, Dana Farber Cancer Institute and Children's Hospital Boston, Harvard Medical School, 450 Brookline Ave, Boston, MA 02115, USA.""]"
"['Journal Article', 'Research Support, N.I.H., Extramural', 'Review']",23933154,Genetics and epigenetics of sporadic thyroid cancer.,2014 Apr 5,386,1-2,55-66,S0303-7207(13)00325-0 [pii] 10.1016/j.mce.2013.07.030 [doi],"Thyroid carcinoma is the most common endocrine malignancy, and although the disease generally has an excellent prognosis, therapeutic options are limited for patients not cured by surgery and radioiodine. Thyroid carcinomas commonly contain one of a small number of recurrent genetic mutations. The identification and study of these mutations has led to a deeper understanding of the pathophysiology of this disease and is providing new approaches to diagnosis and therapy. Papillary thyroid carcinomas usually contain an activating mutation in the RAS cascade, most commonly in BRAF and less commonly in RAS itself or through gene fusions that activate RET. A chromosomal translocation that results in production of a PAX8-PPARG fusion protein is found in follicular carcinomas. Anaplastic carcinomas may contain some of the above changes as well as additional mutations. Therapies that are targeted to these mutations are being used in patient care and clinical trials.","['Vu-Phan D', 'Koenig RJ']","['Department of Internal Medicine, Division of Metabolism, Endocrinology and Diabetes, University of Michigan, Ann Arbor, MI, USA. Electronic address: vudang@umich.edu.', 'Department of Internal Medicine, Division of Metabolism, Endocrinology and Diabetes, University of Michigan, Ann Arbor, MI, USA. Electronic address: rkoenig@umich.edu.']"
"['Case Reports', 'Journal Article', 'Review']",19996579,Anal mucosal melanoma with KIT-activating mutation and response to imatinib therapy--case report and review of the literature.,2010,220,1,77-81,10.1159/000265558 [doi],"Previously an increased frequency of KIT aberrations in mucosal melanomas was reported, whereas c-KIT in most types of cutaneous melanomas does not appear to be of pathogenetic importance. Imatinib has become the standard of care in other cancers with KIT mutations such as gastrointestinal stromal tumors. Recently 12 cases of metastatic melanoma and KIT-activating mutations have been published to be successfully treated with c-KIT blockers such as imatinib, sunitinib, dasatinib or sorafenib. We report here on one of our patients with KIT-activating mutation in metastatic anal mucosal melanoma, who showed a response to imatinib therapy and summarize the available literature regarding this new therapeutic option.","['Satzger I', 'Küttler U', 'Völker B', 'Schenck F', 'Kapp A', 'Gutzmer R']","['Skin Cancer Center Hannover, Department of Dermatology and Allergy, Hannover Medical School, Hannover, Germany. satzger.imke @ mh-hannover.de']"
"['English Abstract', 'Journal Article', ""Research Support, Non-U.S. Gov't"", 'Review']",25656857,[Systemic treatment of brain metastases from lung cancer].,2015 Feb,19,1,43-7,S1278-3218(15)00006-2 [pii] 10.1016/j.canrad.2014.12.001 [doi],"Systemic treatment of lung cancer patients with brain metastases is based on clinical (presence of symptomatic intracranial lesions), pathological and molecular characteristics of the disease. The efficacy of standard platinum-based chemotherapy is comparable inside and outside the brain, justifying its use as front-line therapy. The intracranial efficacy of targeted therapies (EGFR tyrosine kinase inhibitors, ALK inhibitors) is demonstrated, and is globally superior to the efficacy of standard chemotherapy, justifying their use as front-line therapy in case of EGFR activating mutation or ALK rearrangement (providing the change in the crizotinib label in France). The concomitant use of whole brain radiotherapy and a systemic treatment (chemotherapy or targeted therapy) is not recommended in the absence of a demonstrated better efficacy and/or acceptable safety profile. Several trials are ongoing to assess new whole brain radiotherapy modalities, new targeted therapies alone or in combination, especially exploring immunotherapy.","['Barlesi F', 'Spano JP', 'Cortot AB', 'Carpentier AF', 'Robinet G', 'Besse B']","[""Service d'oncologie multidisciplinaire et d'innovations thérapeutiques, Assistance publique-Hôpitaux de Marseille (AP-HM), chemin des Bourrely, 13915 Marseille cedex 20, France; Université Aix-Marseille, boulevard Charles-Livon, 13007 Marseille, France; Groupe de recherche sur la prise en charge des métastases cérébrales (GRPCMac), 13273 Marseille, France. Electronic address: fabrice.barlesi@ap-hm.fr."", ""Groupe de recherche sur la prise en charge des métastases cérébrales (GRPCMac), 13273 Marseille, France; Département d'oncologie médicale, groupe hospitalier de la Pitié-Salpêtrière, Assistance publique-Hôpitaux de Paris (AP-HP), 47-83, boulevard de l'Hôpital, 75013 Paris, France."", ""Service de pneumologie et d'oncologie thoracique, CHRU de Lille, 59037 Lille, France."", 'Service de neurologie, hôpital Avicenne, Assistance publique-Hôpitaux de Paris (AP-HP), 125, rue de Stalingrad, 93000 Bobigny, France.', 'Institut de cancérologie et hématologie, CHRU Morvan, 2, avenue Foch, 29609 Brest cedex, France.', 'Institut de cancérologie Gustave-Roussy, cancer campus, 114, rue Édouard-Vaillant, 94805 Villejuif, France; Université Paris-Sud, 5, rue Jean-Baptiste-Clément, 92296 Châtenay-Malabry cedex, France.']"
"['Journal Article', ""Research Support, Non-U.S. Gov't"", 'Review']",22654442,"Serrated polyposis syndrome: molecular, pathological and clinical aspects.",2012 May 28,18,20,2452-61,10.3748/wjg.v18.i20.2452 [doi],"Hyperplastic polyps have traditionally been considered not to have malignant potential. New pathological classification of serrated polyps and recent discoveries about the serrated pathway of carcinogenesis have revolutionized the concepts and revitalized the research in this area. Until recently, it has been thought that most colorectal cancers arise from conventional adenomas via the traditional tumor suppressor pathway initiated by a mutation of the APC gene, but it has been found that this pathway accounts for only approximately 70%-80% of colorectal cancer (CRC) cases. The majority of the remaining colorectal cancer cases follow an alternative pathway leading to CpG island methylator phenotype carcinoma with BRAF mutation and with or without microsatellite instability. The mechanism of carcinomas arising from this alternative pathway seems to begin with an activating mutation of the BRAF oncogene. Serrated polyposis syndrome is a relatively rare condition characterized by multiple and/or large serrated polyps of the colon. Clinical characteristics, etiology and relationship of serrated polyposis syndrome to CRC have not been clarified yet. Patients with this syndrome show a high risk of CRC and both sporadic and hereditary cases have been described. Clinical criteria have been used for diagnosis and frequent colonoscopy surveillance should be performed in order to prevent colorectal cancer. In this review, we try to gather new insights into the molecular pathogenesis of serrated polyps in order to understand their possible clinical implications and to make an approach to the management of this syndrome.","['Guarinos C', 'Sánchez-Fortún C', 'Rodríguez-Soler M', 'Alenda C', 'Payá A', 'Jover R']","['Research Unit, Hospital General Universitario de Alicante, 03010 Alicante, Spain.']"
"['Journal Article', 'Review']",21084242,[Molecular biology of soft-tissue sarcomas].,2010 Nov,97,11,1337-45,10.1684/bdc.2010.1213 [doi],"Sarcomas represent a heterogeneous group of tumors with a complex and poorly reproducible classification. However, in the last ten years, several specific genetic alterations have been described allowing a molecular classification with: 1) sarcomas with a specific translocation which can be used as a diagnostic marker. These translocations can be demonstrated by RT-PCR or by FISH with commercially available break apart probes ; 2) sarcomas with simple genomic profile showing amplification of a few genes. Well differentiated liposarcomas, dedifferentiated liposarcomas and intimal sarcomas show a simple genomic profile characterised by MDM2 and CDK4 amplifications associated with amplification of other genes in dedifferentiated liposarcomas ; 3) sarcomas with activating mutations: about 90% of GIST show activating mutation of a receptor tyrosine kinase gene, either KIT or PDGFRA. The most frequent mutation involves exon 11 of KIT followed by exon 9 of KIT and exon 18 of PDGFRA. Demonstration of these mutations is useful for the diagnosis of CD117 negative GIST, for predicting response to imatinib and to explain secondary resistance to imatinib ; 4) sarcomas with inactivating mutations: malignant rhabdoid tumors show biallelic inactivation of INI1 gene with a lost of INI1 expression which can be demonstrated by immunohistochemistry ; 5) other sarcomas usually show a complex genomic profile characterised by numerous gains and losses of genes with a frequent loss of RB1 and alterations of P53. Leiomyosarcomas, pleomorphic rhabdomyosarcomas, pleomorphic liposarcomas, myxofibrosarcomas, poorly differentiated sarcomas (so-called MFH and fibrosarcomas) belong to this category and show no specific molecular abnormality.",['Coindre JM'],"['Département de pathologie, Institut Bergonié, Université Victor-Segalen, Bordeaux, France. coindre@bergonie.org']"
"['Journal Article', ""Research Support, Non-U.S. Gov't"", 'Review']",23911281,Therapeutic strategy for advanced EGFR mutant non-small-cell lung carcinoma.,2013 Dec,88,3,477-93,S1040-8428(13)00129-7 [pii] 10.1016/j.critrevonc.2013.06.009 [doi],"Activating mutation in exons 19 or 21 of epidermal growth factor receptor (EGFR) in non-small-cell lung cancers (NSCLC) are associated with increased sensitivity to EGFR tyrosine kinase inhibitors (EGFR-TKIs), such as gefitinib and erlotinib. Cancer patients harboring activating EGFR mutations benefit from first-line TKI therapy. Yet 10% of patients present a primary TKI resistance, while 50% of the others develop a secondary resistance within 9-12 months after starting TKI. The RECIST's definition of progression appears flawed when applied to EGFR-mutated NSCLC patients. Most often, tumor volume shrinking widely exceeds 30% during TKI response and kinetics of growth is low during relapse. At present, secondary resistance mechanisms associated with progression are better known: clonal selection of EGFR resistance mutation (T790M mutation in exon 20), amplification of transmembrane receptors for other growth factors (c-met, HER family, IGF1R, or AXL), downstream molecular alterations in EGFR signaling pathway (PI3K or PTEN), and epithelial-mesenchymal transition or transdifferentiation to small-cell cancer. The best strategy for secondary resistance is not well-defined: maintaining TKI therapy, switching to chemotherapy, combining both treatments, or using new therapies targeting other signaling pathways.","['Cadranel J', 'Ruppert AM', 'Beau-Faller M', 'Wislez M']","['Service de Pneumologie, Hôpital Tenon, Assistance Publique-Hôpitaux de Paris, France; Equipe de Recherche 2 et GRC-UPMC 04 Theranoscan, Université Pierre et Marie Curie, Paris VI, France. Electronic address: jacques.cadranel@tnn.aphp.fr.']"
"['Journal Article', ""Research Support, Non-U.S. Gov't"", 'Review']",23478237,Genetically engineered mouse models of PI3K signaling in breast cancer.,2013 Apr,7,2,146-64,S1574-7891(13)00027-6 [pii] 10.1016/j.molonc.2013.02.003 [doi],"Breast cancer is the most common type of cancer in women. A substantial fraction of breast cancers have acquired mutations that lead to activation of the phosphoinositide 3-kinase (PI3K) signaling pathway, which plays a central role in cellular processes that are essential in cancer, such as cell survival, growth, division and motility. Oncogenic mutations in the PI3K pathway generally involve either activating mutation of the gene encoding PI3K (PIK3CA) or AKT (AKT1), or loss or reduced expression of PTEN. Several kinases involved in PI3K signaling are being explored as a therapeutic targets for pharmacological inhibition. Despite the availability of a range of inhibitors, acquired resistance may limit the efficacy of single-agent therapy. In this review we discuss the role of PI3K pathway mutations in human breast cancer and relevant genetically engineered mouse models (GEMMs), with special attention to the role of PI3K signaling in oncogenesis, in therapeutic response, and in resistance to therapy. Several sophisticated GEMMs have revealed the cause-and-effect relationships between PI3K pathway mutations and mammary oncogenesis. These GEMMs enable us to study the biology of tumors induced by activated PI3K signaling, as well as preclinical response and resistance to PI3K pathway inhibitors.","['Klarenbeek S', 'van Miltenburg MH', 'Jonkers J']","['Division of Molecular Pathology, Cancer Genomics Centre Netherlands and Cancer Systems Biology Center, The Netherlands Cancer Institute, Plesmanlaan 121, 1066 CX Amsterdam, The Netherlands.']"
"['Comparative Study', 'English Abstract', 'Journal Article', 'Review']",18406017,[Current concepts and treatment advances in systemic mastocytosis].,2009 Jan,30,1,25-34,10.1016/j.revmed.2008.01.025 [doi],"PURPOSE: Mast cell disorders are defined by an abnormal accumulation of tissue mast cells in one or more organ systems. Clinical symptoms in mastocytosis result from mast cells derived mediators and, less frequently, from destructive infiltration of mast cells. Systemic mastocytosis is regressive among children, whereas the disease is persistent among adults. A clonal haematological non-mast cell lineage disease can be associated. The clinical course in these patients is variable ranging from asymptomatic for years to highly aggressive and rapidly devastating. Until recently, the only treatment of this incurable disease was symptomatic. CURRENT KNOWLEDGE AND KEY POINTS: Recent advances were done in understanding the physiopathology of this myeloproliferative syndrome which results from an activating mutation of the stem cell factor receptor: C-Kit. A somatic C-Kit mutation is usually detectable in mast cells and their progenitors. Different mutations were found and the mutation D816V is the most frequent. Their specific transduction paths were also studied. Diagnosis of systemic mastocytosis does not only rest upon pathological examination but also on molecular as well as immunological and immunochemical tools. FUTURE PROSPECTS AND PROJECTS: Physiopathological advancements led to suggest new treatments in order to directly inhibit proliferative paths of masts cells such as tyrosine kinase inhibitors and rapamycin.","['Georgin-Lavialle S', 'Barete S', 'Suarez F', 'Lepelletier Y', 'Bodemer C', 'Dubreuil P', 'Lortholary O', 'Hermine O']","[""Service d'hématologie adultes, CNRS-UMR 8147, centre de référence sur les mastocytoses, hôpital Necker-Enfants-Malades, université Paris-V, Paris, France.""]"
"['Journal Article', 'Review']",20073070,ABL1 rearrangements in T-cell acute lymphoblastic leukemia.,2010 Apr,49,4,299-308,10.1002/gcc.20743 [doi],"T-cell acute lymphoblastic leukemia (T-ALL) is the result of multiple oncogenic insults of thymocytes. Recently, new ABL1 fusion genes have been identified that provide proliferation and survival advantage to lymphoblasts. These are the NUP214-ABL1 fusion gene, on amplified episomes, the unique case of EML1-ABL1 fusion due to a cryptic t(9;14)(q34;q32) and the seldom reported BCR-ABL1 and ETV6-ABL1 chimeric genes. The most frequent and strictly associated with T-ALL is the NUP214-ABL1 fusion identified in 6% of cases, in both children and adults. Patients present with classical T-ALL features. Cytogenetically, the fusion is cryptic but seen by FISH on amplified episomes or more rarely as a small hsr. The ABL1 fusion is a late event associated with other genetic alterations like NOTCH1 activating mutation, deletion of CDKN2A locus, and ectopic expression of TLX1 or TLX3. The mechanism of activation of the NUP214-ABL1 protein is unique and requires localization at the nucleopore complex and interaction with other nuclear pore proteins for crossphosphorylation and constitutive kinase activity. The ABL1 fusion proteins are sensitive to tyrosine kinase inhibitors, which can be included in future treatment strategy.","['Hagemeijer A', 'Graux C']","['Department of Human Genetics, University of Leuven, Leuven, Belgium. Anne.Hagemeijer@med.kuleuven.be']"
"['Journal Article', ""Research Support, Non-U.S. Gov't"", 'Review']",20031962,Advances in target therapy for lung cancer.,2010 Feb,40,2,101-6,10.1093/jjco/hyp174 [doi],"Recent progress in molecular biology has shown that cancer cells acquire common phenotypes such as self-sufficiency of growth signals, resistance to anti-proliferative and apoptotic signals through the accumulation of genetic and epigenetic changes. Recently developed anticancer drugs target these molecular mechanisms and good results have been reported for various cancer types. In lung cancer, tyrosine kinase inhibitors specific for the epidermal growth factor receptor such as gefitinib and erlotinib have changed clinical practice dramatically. About half of the Japanese patients with lung cancers harbor an activating mutation of the epidermal growth factor receptor gene and they are very sensitive to epidermal growth factor receptor tyrosine kinase inhibitors. Progression-free survival of such patients is approximately 10 months when treated with gefitinib, whereas the survival for those treated with platinum doublet therapy is approximately 6 months. Target therapies against echinoderm microtubule-associated protein-like 4-anaplastic lymphoma kinase fusion protein or a mutated ERBB2 (v-ERB-B avian erythroblastic leukemia viral oncogene homologue 2) present in approximately 5% and approximately 3% of the Japanese patients with adenocarcinomas, respectively, are currently under development. Addition of an anti-epidermal growth factor receptor antibody, cetuximab, or anti-vascular endothelial growth factor antibody, bevacizumab, to platinum doublet therapy significantly but modestly prolonged the survival in recent clinical trials. However, clinical development of small molecule multi-kinase inhibitors including those targeting vascular endothelial growth factor receptors, such as vandetanib, sunitinib and sorafenib, has not been very successful. Through these collaborations among clinicians, basic researchers and pharmaceutical companies, it should be possible to individualize lung cancer treatment to turn this fatal disease into a chronic disorder and, eventually, to cure it.",['Mitsudomi T'],"['Department of Thoracic Surgery, Aichi Cancer Center Hospital, Nagoya, Japan. mitsudom@aichi-cc.jp']"
"['English Abstract', 'Journal Article', 'Review']",18541514,[New molecular targets in pancreatic cancer].,2008 May,95,5,503-12,10.1684/bdc.2008.0632 [doi],"The understanding of the biology of pancreatic carcinoma has greatly benefited from studies of genetic alterations and molecular expression in experimental models as well as in pre-cancerous and cancerous tissues by mean of molecular amplification and large scale transcriptome analysis. P16, TP53, DPC4/Smad4 tumor suppressor pathways are genetically inactivated in the majority of pancreatic carcinomas, whereas oncogenic k-ras is activated. The activating mutation of the K-ras oncogene on codon 12 seems to occur early in pancreatic carcinogenesis and detecting its mutation in tumor samples could have a clinical relevance in term of positive (improvement of current histological diagnosis) and differential diagnosis (versus chronic pancreatitis) of pancreatic cancer. At a late stage of tumor development, an increase of telomerase activity, an over expression of growth factors and/or their receptors (EGF, nerve growth factor, gastrin, bombesin), of proangiogenic factors (VEGF, FGF, PDGF), of invasiveness factors (metalloproteinases, E-cadherin, beta integrin, urokinase and tissue plasminogen activator) occur. All these molecular events contribute to the progression and to the metastatic potential of this carcinoma. New markers and targets are currently studied among microRNA and epigenetics events such as methylation and acetylation. Among all these molecular markers, some are now tested for their potential clinical interest in term of diagnosis or therapeutic target.","['Torrisani J', 'Bournet B', 'Cordelier P', 'Buscail L']","['Inserm U858, Institut de médecine moléculaire et Service de gastro-entérologie et nutrition, CHU Rangueil, TSA 50032, 31059 Toulouse Cedex 9.']"
