Article_type,PMID,Title,DP,Volume,Issue,Page,Doi,Abstract,Author,Affiliation
"['Journal Article', 'Review']",32145961,[Androgen receptor-positive triple negative breast cancer: From biology to therapy].,2020 Apr,107,4,506-516,S0007-4551(20)30115-6 [pii] 10.1016/j.bulcan.2019.12.012 [doi],"A subgroup of androgen receptor-expressing tumors represents approximately 30 % of all triple negative tumors. The androgen receptor and its signaling pathways have a central biological role in this tumor entity. These triple negative androgen receptor-positive tumors occur in older patients and do not appear to have a better prognosis compared to other triple negative tumors. In addition to androgen receptor-expression, these tumors are genomically characterized by a high frequency of PIK3CA activating mutation. Three clinical trials reported efficacy data for anti-androgens (bicalutamide, abiraterone acetate and enzalutamide) based on strong preclinical rationale. These trials report clinical benefit rates in about one in five patients. These encouraging but still limited results make a case for the identification of predictive response factors and therapeutic combinations to improve response rates. This review will provide an update on the biological and clinical knowledge of this tumoral subgroup that opens the way to non-cytotoxic anti-androgen therapies.",['Grellety T'],"[""Centre hospitalier de la Côte Basque, service d'oncologie médicale, 13, avenue de l'Interne Jacques-Loeb, 64100 Bayonne, France; Institut Bergonié, département d'oncologie médicale, 229, cours de l'Argonne, 33076 Bordeaux, France. Electronic address: tgrellety@ch-cotebasque.fr.""]"
"['Case Reports', 'Journal Article', 'Review']",32930150,"Epidermal growth factor receptor-activating mutation(E746_T751>VP) in pancreatic ductal adenocarcinoma responds to erlotinib, followed by epidermal growth factor receptor resistance-mediating mutation (A647T): A case report and literature review.",2020 Jul-Sep,16,4,950-954,10.4103/jcrt.JCRT_729_18 [doi],"Despite recent advances in treatment with multidrug chemotherapy regimens, outcomes of patients with advanced pancreatic ductal adenocarcinoma (PDAC) remain very poor. Treatment with targeted therapies has shown marginal benefits due to intrinsic or acquired resistance. Actionable mutations, while detected infrequently in patients with PDAC, are becoming increasingly used in personalized medicine. Here, we describe an epidermal growth factor receptor (EGFR)-activating mutation (E746_T751>VP) to erlotinib, a first-generation tyrosine kinase inhibitor (TKI), in a patient with metastatic PDAC. After an initial partial response to erlotinib for 12 months, the patient's disease progressed with emergence of the EGFR A647T mutation. Certainly, the patient also progressed after switching therapy to a third-generation EGFR TKI (osimertinib). This case illustrates the posttreatment evolution of EGFR A647T-mediated resistance to the first- and third-generation TKIs. To our knowledge, this is the first case to report the aforementioned activating and resistance-mediated mutations. In summary, genomic analysis performed in this patient with PDAC on the tumor biopsy and peripheral blood provided tools to understand mechanisms of response and resistance to targeted therapy with EFGR TKIs.","['Patel GK', 'Perry JB', 'Abdul-Rahim O', 'Frankel AE', 'Cameron D', 'Taylor W', 'Rocconi RP', 'Abushahin L', 'Nelson C', 'Singh AP', 'Khushman M']","['Department of Oncologic Sciences, Mitchell Cancer Institute, The University of South Alabama, Mobile, Alabama, USA.', 'College of Allied Health Professions, The University of South Alabama, Mobile, Alabama, USA.', 'Division of Interventional Radiology, The University of South Alabama, Mobile, Alabama, USA.', 'Medical Oncology, Mitchell Cancer Institute, The University of South Alabama, Mobile, Alabama, USA.', 'Medical Oncology, Mitchell Cancer Institute, The University of South Alabama, Mobile, Alabama, USA.', 'Medical Oncology, Mitchell Cancer Institute, The University of South Alabama, Mobile, Alabama, USA.', 'Gynecology Oncology, Mitchell Cancer Institute, The University of South Alabama, Mobile, Alabama, USA.', 'Medical Oncology, The James Comprehensive Cancer Center, The Ohio State University, Columbus, OH, USA.', 'Division of Interventional Radiology, The University of South Alabama, Mobile, Alabama, USA.', 'Department of Oncologic Sciences, Mitchell Cancer Institute, The University of South Alabama, Mobile, Alabama, USA.', 'Division of Interventional Radiology, The University of South Alabama, Mobile, Alabama, USA.']"
"['Journal Article', 'Review']",22369373,BRAF mutation testing in clinical practice.,2012 Mar,12,2,127-38,10.1586/erm.12.1 [doi],"Serine/threonine-protein kinase BRAF, a downstream effector of the RAS oncogene along the MEK/ERK signaling pathway, has emerged as an important biological marker for diagnosis, prognosis and therapeutic guidance for human cancers. The high prevalence of BRAF(V600E) activating mutation in papillary thyroid carcinoma, cutaneous malignant melanoma and hairy cell leukemia implies that the mutation is an important 'driver' or 'codriver' in the development of a subset of these cancers. Diagnostically, the BRAF(V600E) mutation is a powerful molecular marker for papillary thyroid carcinoma and, quite possibly, hairy cell leukemia as well. Cancers with a BRAF mutation are generally more aggressive than their counterparts without the mutation. Importantly, mutant BRAF has been a highly attractive target for precision cancer therapy. Indeed, recent studies in the clinical trials of BRAF inhibitors in patients with malignant melanoma are changing the treatment paradigm of this highly lethal disease. BRAF mutation testing using highly sensitive and specific methodology in a molecular diagnostic laboratory is essential in the current clinical practice of oncology.","['Ziai J', 'Hui P']","['Department of Pathology, Yale University School of Medicine, New Haven, CT 06520, USA.']"
"['Journal Article', 'Review']",23094782,Vemurafenib for the treatment of melanoma.,2012 Dec,13,17,2533-43,10.1517/14656566.2012.737780 [doi],"INTRODUCTION: Metastatic melanoma is an aggressive disease resistant to chemotherapy. Recent clinical trials have reported improved survival for two novel agents; ipilimumab, a humanized, IgG1 monoclonal antibody that blocks cytotoxic T-lymphocyte-associated antigen 4 (CTLA-4) and vemurafenib , a BRAF (v-raf murine sarcoma viral oncogene homolog B1) inhibitor targeting an activating mutation in the serine-threonine-protein kinase BRAF gene. AREAS COVERED: The authors reviewed preclinical and clinical data examining the safety of vemurafenib in melanoma. MEDLINE and EMBASE were searched using the medical subject heading 'vemurafenib' and the following text terms: melanoma, BRAF inhibition, vemurafenib. This review provides the reader with an overview of current data examining the efficacy and safety of vemurafenib in metastatic melanoma. EXPERT OPINION: Vemurafenib is an oral agent licensed for patients with BRAF V600E mutation-positive inoperable and metastatic melanoma. The most common adverse effects observed in Phase III clinical trials were dermatological events, arthralgia and fatigue. Specific dermatological toxicities included development of cutaneous squamous cell cancers and keratoacanthomas. Prolongation of the QT interval was also reported. Regular dermatological assessments and electrocardiograms are recommended. Ongoing trials are examining vemurafenib in both the adjuvant setting and metastatic setting in combination with ipilimumab and MEK inhibitors (mitogen-activated protein kinase/extracellular signal-regulated kinase). Understanding and overcoming mechanisms of resistance to BRAF inhibitors is the focus of ongoing research.","['Jordan EJ', 'Kelly CM']","['Waterford Regional Hospital, Department of Medical Oncology, Dunmore Road, Waterford, Ireland.']"
"['Journal Article', 'Review']",32267188,Safety of EGFR-TKIs for EGFR mutation-positive non-small cell lung cancer.,2020 May,19,5,589-599,10.1080/14740338.2020.1753697 [doi],"Introduction: Lung cancer is the most prevalent malignant tumors worldwide. Over the past decade, the emergence of epidermal growth factor receptor-tyrosine kinase inhibitors (EGFR-TKIs) has ushered in a new era of lung cancer treatment. Therefore, clinical trials investigating the efficacy and safety of these drugs are important.Areas covered: This review provides an overview on the safety of three classes of EGFR-TKIs and discusses the adverse events (AEs) and reactions reported in the literature.Expert opinion: EGFR-TKIs significantly improve progression-free survival and overall survival in non-small cell lung cancer (NSCLC) patients with an activating mutation of EGFR. However, EGFR-TKIs also block the EGFR-regulating pathways in the skin and gastrointestinal tract and cause AEs, including diarrhea, liver toxicity, skin disease, stomatitis, interstitial lung disease, and ocular toxicity, which have detrimental effects on quality of life and drug compliance. Clinicians should understand how to prevent and control these adverse reactions, which can often be achieved by dose reduction, discontinuation of treatment, or switching to another drug.","['Zhou JY', 'Liu SY', 'Wu YL']","[""Guangdong Lung Cancer Institute, Guangdong Provincial People's Hospital, Guangdong Academy of Medical Sciences, School of Medicine, South China University of Technology, Guangzhou, China."", ""Guangdong Lung Cancer Institute, Guangdong Provincial People's Hospital, Guangdong Academy of Medical Sciences, School of Medicine, South China University of Technology, Guangzhou, China."", ""Guangdong Lung Cancer Institute, Guangdong Provincial People's Hospital, Guangdong Academy of Medical Sciences, School of Medicine, South China University of Technology, Guangzhou, China.""]"
"['Journal Article', 'Review']",32132734,HEREDITARY PITUITARY TUMOR SYNDROMES: GENETIC AND CLINICAL ASPECTS.,2020,72,1,8-18,10.24875/RIC.19003186 [doi],"The pituitary gland is responsible for the synthesis and secretion of various hormones that play a key role in regulating endocrine function and homeostasis. Pituitary adenomas (PA) are benign epithelial tumors arising from the endocrine cells of the anterior pituitary gland. Clinically relevant PA are relatively common and they occur in 0.1% of the general population. They are mostly benign monoclonal neoplasms that arise from any of the five hormone-secreting cell types of the anterior pituitary gland. PA are categorized as either functioning or non-functioning, depending on whether or not they produce a hormonal hypersecretion syndrome. Both functioning and non-functioning adenomas can produce symptoms or signs resulting from compression of the optic chiasm or invasion of cavernous sinuses. Only 5% of PA occur within the context of hereditary syndromes with reasonably well-defined oncogenic mechanisms. The vast majority of PA are sporadic, and their etiopathogenesis remains largely unknown. Pituitary tumor oncogenesis involves several mechanisms that eventually lead to abnormal cell proliferation and dysregulated hormone production. Among these factors, we found inactivating mutations of tumor suppressor genes, activating mutation of oncogenes and the participation of hormonal signals coming from the hypothalamus, all resulting in cell-cycle regulation abnormalities. In this review, we summarize the clinical and pathophysiological aspects of the different hereditary pituitary tumor syndromes.","['García-Guzmán B', 'Portocarrero-Ortiz L', 'Dorantes-Argandar AA', 'Mercado M']","['Endocrinology Service, Instituto Nacional de Neurología y Neurocirugía, Mexico City, Mexico.', 'Endocrinology Service, Instituto Nacional de Neurología y Neurocirugía, Mexico City, Mexico.', 'Neurosurgery Service and Hospital de Especialidades, Centro Médico Nacional Siglo XXI, Instituto Mexicano del Seguro Social, Mexico City, Mexico.', 'Experimental Endocrinology Unit, Hospital de Especialidades, Centro Médico Nacional Siglo XXI, Instituto Mexicano del Seguro Social, Mexico City, Mexico.']"
"['Journal Article', ""Research Support, Non-U.S. Gov't"", 'Review']",27813081,Genetics and genomics of ovarian sex cord-stromal tumors.,2017 Feb,91,2,285-291,10.1111/cge.12917 [doi],"Ovarian sex cord-stromal tumors (SCST) represent approximately 8% of malignant ovarian tumors. The most common are granulosa cell tumors (GCT) which account for approximately 90% of malignant SCST. Recent studies have unraveled the key genomic and genetic events contributing to their pathogenesis. SCST are found in the hereditary syndromes: Peutz-Jeghers syndrome, Ollier disease and Maffucci syndrome, and DICER1 syndrome. Genomic studies have largely been limited to GCT where a number of recurring chromosomal abnormalities (monsomy and trisomy) have been identified although their contribution to pathogenesis remains unclear. In addition to the recurrent DICER1 mutations reported in non-hereditary cases of Sertoli cell and Sertoli-Leydig cell tumors, recurrent somatic mutations in both the juvenile (j) and adult (a) forms of GCT have been reported. Approximately 30% of jGCT contain a somatic mutation, the gsp oncogene, while a further 60% have an activating mutation in the AKT gene. In the case of aGCT, a well characterized mutation in the FOXL2 transcription factor (FOXL2 C134W) is found in almost all cases, which arguably defines the disease, although the molecular events that determine the stage, behavior and prognosis of aGCT remain to be determined.","['Fuller PJ', 'Leung D', 'Chu S']","['Centre for Endocrinology and Metabolism, Hudson Institute of Medical Research, Clayton, Australia.', 'Department of Molecular and Translational Science, Monash University, Clayton, Australia.', 'Centre for Endocrinology and Metabolism, Hudson Institute of Medical Research, Clayton, Australia.', 'Department of Molecular and Translational Science, Monash University, Clayton, Australia.', 'Centre for Endocrinology and Metabolism, Hudson Institute of Medical Research, Clayton, Australia.', 'Department of Molecular and Translational Science, Monash University, Clayton, Australia.']"
"['Journal Article', 'Review']",26450446,AZD9291 in EGFR-mutant advanced non-small-cell lung cancer patients.,2015 Nov,11,22,3069-81,10.2217/fon.15.250 [doi],"Non-small-cell lung cancer (NSCLC) patients whose tumors have an EGFR-activating mutation develop acquired resistance after a median of 9-11 months from the beginning of treatment with erlotinib, gefitinib and afatinib. T790M mutation is the cause of this resistance in approximately 60% of cases. AZD9291 is an oral, irreversible, mutant-selective EGF receptor (EGFR) tyrosine kinase inhibitor (TKI) developed to have potency against EGFR mutations, including T790M mutation, while sparing wild-type EGFR. A Phase I trial of AZD9291 in EGFR-mutant NSCLC patients, demonstrated high activity, essentially among T790M-mutant tumors, with a manageable tolerability profile. Ongoing Phase III trials are evaluating AZD9291 in EGFR-mutant patients as first-line treatment compared with erlotinib and gefitinib; and as second-line treatment compared with chemotherapy after progression on EGFR TKI in T790M-mutant tumors. Better identification of T790M-mutant tumors post EGFR TKI relapse and mechanisms of resistance to AZD9291 are the future challenges. This article reviews the emerging data regarding AZD9291 in the treatment of patients with advanced NSCLC.","['Remon J', 'Planchard D']","['Gustave Roussy, Medical Oncology Department, Villejuif, France.', 'Gustave Roussy, Medical Oncology Department, Villejuif, France.']"
"['Case Reports', 'Journal Article', 'Review']",31882020,Activating BRAF mutation in sclerosing mucoepidermoid carcinoma with eosinophilia of the thyroid gland: two case reports and review of the literature.,2019 Dec 28,13,1,385,10.1186/s13256-019-2288-0 [doi] 385,"BACKGROUND: Sclerosing mucoepidermoid carcinoma with eosinophilia is a rare form of thyroid carcinoma. The underlying molecular mechanisms of sclerosing mucoepidermoid carcinoma with eosinophilia tumorigenesis remain unknown. CASE PRESENTATION: We present two cases of sclerosing mucoepidermoid carcinoma with eosinophilia, both with a concurrent papillary thyroid carcinoma. Patient 1, a 70-year-old Caucasian woman, presented with sclerosing mucoepidermoid carcinoma with eosinophilia with distant renal metastasis and coexisting papillary thyroid carcinoma. Patient 2, a 74-year-old Caucasian woman with a remote history of thyroid cancer treated with thyroidectomy, presented with locoregionally invasive sclerosing mucoepidermoid carcinoma with eosinophilia and recurrent papillary thyroid carcinoma in the thyroid bed. BRAF mutation studies were performed on the sclerosing mucoepidermoid carcinoma with eosinophilia tumors. In both cases, sclerosing mucoepidermoid carcinoma with eosinophilia was positive for the BRAF V600E mutation by polymerase chain reaction. Patient 1 is the first reported case of sclerosing mucoepidermoid carcinoma with eosinophilia with renal metastasis, to the best of our knowledge. CONCLUSIONS: Our findings suggest, for the first time, to our knowledge, involvement of the RAS-RAF-MEK-ERK signaling pathway in the pathogenesis of sclerosing mucoepidermoid carcinoma with eosinophilia. Thus, BRAF inhibitors may prove to be a useful targeted medical therapy in the treatment of a subset of patients with aggressive sclerosing mucoepidermoid carcinoma with eosinophilia tumors who exhibit BRAF activating mutation.","['Sukumar JS', 'Sukumar S', 'Purohit D', 'Welch BJ', 'Balani J', 'Yan S', 'Hathiramani SS']","['Department of Internal Medicine, UT Southwestern Medical Center, 5323 Harry Hines Boulevard, Dallas, TX, 75390, USA.', 'Department of Internal Medicine, UT Southwestern Medical Center, 5323 Harry Hines Boulevard, Dallas, TX, 75390, USA.', 'Department of Endocrinology, Capital Diabetes and Endocrine Associates, 5801 Allentown Road, Suite 500, Camp Springs, MD, 20746, USA.', 'Department of Endocrinology, Baylor University Medical Center, 3500 Gaston Avenue, Dallas, TX, 75246, USA.', 'Department of Pathology, UT Southwestern Medical Center, 5323 Harry Hines Boulevard, Dallas, TX, 75390, USA.', 'Department of Pathology, UT Southwestern Medical Center, 5323 Harry Hines Boulevard, Dallas, TX, 75390, USA.', 'Department of Internal Medicine, UT Southwestern Medical Center, 5323 Harry Hines Boulevard, Dallas, TX, 75390, USA. sumitha.hathiramani@va.gov.', 'Division of Endocrinology, VA North Texas Healthcare System, 4500 South Lancaster Road, Dallas, TX, 75216, USA. sumitha.hathiramani@va.gov.']"
"['Journal Article', 'Review']",18798058,RAS: target for cancer therapy.,2008 Nov,26,9,948-55,10.1080/07357900802087275 [doi],"The RAS protein controls signaling pathway are major player in cell growth, its regulation and malignant transformation. Any activation in RAS brings alteration in upstream or downstream signaling component. Activating mutation in RAS is found in approximately 30% of human cancer. RAS plays essential role in tumor maintenance and is therefore an appropriate target for anticancer therapy. Among the anti-RAS strategies that are under evaluation in the clinic are pharmacologic inhibitors designed to prevent: (1) association with the plasma membrane (prenylation and post prenylation inhibitors). (2) Downstream signaling (kinase inhibitor), (3) upstream pathway (kinase inhibitor and monoclonal antibody), (4) Expression of RAS or other component of pathway (siRNA and antisense oligonucleotide). Several of these new therapeutic agents are showing promising result in the clinic and many more are on the way. Here, we review the current status and new hopes for targeting RAS as an anticancer drug.","['Saxena N', 'Lahiri SS', 'Hambarde S', 'Tripathi RP']","['Department of Radiation Biology and Radioprotectors, Institute of Nuclear Medicine and Allied Sciences, Delhi, India.']"
"['English Abstract', 'Journal Article', 'Review']",23085694,[Myeloproliferative neoplasms: histopathological and molecular pathological diagnosis].,2012 Nov,33,6,508-17,10.1007/s00292-012-1651-3 [doi],"Myeloproliferative neoplasms (chronic myeloproliferative disorders according to former nomenclature) comprise chronic myeloid leukemia, polycythemia vera, essential thrombocythemia, primary myelofibrosis, chronic eosinophilic leukemia, chronic neutrophilic leukemia and systemic mastocytosis. All disorders have excessive proliferation of one or more hematopoietic lineages in common and progress with different probability to blast crisis or fibrosis. A further common feature is provided by the activating mutation of tyrosin kinases and associated pathways of signal transduction (BCR-ABL, JAK2(V617F), MPL(W515L/K), KIT(D816V) and FIP1L1-PDGFRA) causative for the abnormal proliferation. With regard to diagnosis and therapy these mutations are of utmost importance because they enable the exclusion of reactive processes, contribute with varying specificity to subtyping of MPN and are at least partly sensitive to targeted therapy. The molecular mechanisms of blastic and fibrotic progression are not yet understood.","['Hussein K', 'Büsche G', 'Schlue J', 'Lehmann U', 'Kreipe H']","['Institut für Pathologie, Medizinische Hochschule Hannover, Carl-Neuberg-Str 1, 30625 Hannover, Deutschland.']"
"['Journal Article', 'Review']",25609490,[Molecular biology of sarcoma and therapeutic choices].,2015 Jan,102,1,6-16,S0007-4551(14)00006-X [pii] 10.1016/j.bulcan.2014.12.005 [doi],"Soft tissue sarcomas (STS) are a set of very heterogeneous tumors with numerous histological categories. The development of the molecular biology allowed identifying recurring molecular anomalies in certain subgroups of sarcomas, being able to represent diagnostic, prognosis and therapeutic tools. The molecular classification of STS includes until today 5 main groups of abnormalities: sarcomas with ""simple genomic profile"" showing reciprocal (1) chromosomal translocations, (2) activating mutation, (3) inhibitive mutation or (4) simple amplification; (5) sarcomas with ""complex genomic profile"" can include several tens of molecular abnormalities. The development of new-targeted therapies is based on the identification of a target, specific of a tumors subgroup and involved in carcinogenesis mechanisms and/or tumoral growth. Then, the aim of clinical research is to establish the proof of the concept through clinical trials, demonstrating the benefit brought to the patient and ending in the marketing of the drug. This proof of the concept was clearly established for imatinib, sunitinib and regorafenib in gastrointestinal stromal tumors, for imatinib in dermatofibrosarcoma protuberans and pigmented vilo-nodular synovitis, for denosumab in giant cell tumors of the bone, ending in the authorization to use these new therapies in these indications. It is in progress and promising for anti-IGF-1R in Ewing sarcomas, for crizotinib in myofibroblastic inflammatory tumors, for mTOR inhibitor in PEComas... The role of molecular abnormalities identified in the mechanisms of tumoral progress for sarcomas and their potential therapeutic impact will be detailed.","['Dufresne A', 'Cassier P', 'Heudel P', 'Pissaloux D', 'Wang Q', 'Blay JY', 'Ray-Coquard I']","[""Centre Léon-Bérard, département d'oncologie médicale, 28, rue Laënnec, 69008 Lyon, France. Electronic address: armelle.dufresne@lyon.unicancer.fr."", ""Centre Léon-Bérard, département d'oncologie médicale, 28, rue Laënnec, 69008 Lyon, France."", ""Centre Léon-Bérard, département d'oncologie médicale, 28, rue Laënnec, 69008 Lyon, France."", 'Centre Léon-Bérard, département de biopathologie, 28, rue Laënnec, 69008 Lyon, France.', 'Centre Léon-Bérard, département de biopathologie, 28, rue Laënnec, 69008 Lyon, France.', ""Centre Léon-Bérard, département d'oncologie médicale, 28, rue Laënnec, 69008 Lyon, France."", ""Centre Léon-Bérard, département d'oncologie médicale, 28, rue Laënnec, 69008 Lyon, France.""]"
