Article_type,PMID,Title,DP,Volume,Issue,Page,Doi,Abstract,Author,Affiliation
"['Journal Article', 'Review']",28129709,Profile of the Roche cobas® EGFR mutation test v2 for non-small cell lung cancer.,2017 Mar,17,3,209-215,10.1080/14737159.2017.1288568 [doi],"The discovery of driver mutations in non-small cell lung cancer (NSCLC) has led to the development of genome-based personalized medicine. Fifteen to 20% of adenocarcinomas harbor an epidermal growth factor receptor (EGFR) activating mutation associated with responses to EGFR tyrosine kinase inhibitors (TKIs). Individual laboratories' expertise and the availability of appropriate equipment are valuable assets in predictive molecular pathology, although the choice of methods should be determined by the nature of the samples to be tested and whether the detection of only well-characterized EGFR mutations or rather, of all detectable mutations, is required. Areas covered: The EGFR mutation testing landscape is manifold and includes both screening and targeted methods, each with their own pros and cons. Here we review one of these companion tests, the Roche cobas® EGFR mutation test v2, from a methodological point of view, also exploring its liquid-biopsy applications. Expert commentary: The Roche cobas® EGFR mutation test v2, based on real time RT-PCR, is a reliable option for testing EGFR mutations in clinical practice, either using tissue-derived DNA or plasma-derived cfDNA. This application will be valuable for laboratories with whose purpose is purely diagnostic and lacking high-throughput technologies.","['Malapelle U', 'Sirera R', 'Jantus-Lewintre E', 'Reclusa P', 'Calabuig-Fariñas S', 'Blasco A', 'Pisapia P', 'Rolfo C', 'Camps C']","['a Department of Public Health , University of Naples Federico II , Naples , Italy.', 'b Department of Biotechnology , Universitat Politècnica de València , Valencia , Spain.', 'c Department of Medical Oncology , Hospital General Universitario de Valencia , Valencia , Spain.', 'd Molecular Oncology Laboratory , Fundación Hospital General Universitario de Valencia , Valencia , Spain.', 'b Department of Biotechnology , Universitat Politècnica de València , Valencia , Spain.', 'c Department of Medical Oncology , Hospital General Universitario de Valencia , Valencia , Spain.', 'd Molecular Oncology Laboratory , Fundación Hospital General Universitario de Valencia , Valencia , Spain.', 'e Phase I-Early Clinical Trials Unit, Oncology Department , Antwerp University Hospital , Antwerp , Belgium.', 'f Center for Oncological Research (CORE) , Antwerp University , Antwerp , Belgium.', 'c Department of Medical Oncology , Hospital General Universitario de Valencia , Valencia , Spain.', 'd Molecular Oncology Laboratory , Fundación Hospital General Universitario de Valencia , Valencia , Spain.', 'g Department of Pathology , Universitat de València , Valencia , Spain.', 'c Department of Medical Oncology , Hospital General Universitario de Valencia , Valencia , Spain.', 'a Department of Public Health , University of Naples Federico II , Naples , Italy.', 'e Phase I-Early Clinical Trials Unit, Oncology Department , Antwerp University Hospital , Antwerp , Belgium.', 'f Center for Oncological Research (CORE) , Antwerp University , Antwerp , Belgium.', 'c Department of Medical Oncology , Hospital General Universitario de Valencia , Valencia , Spain.', 'd Molecular Oncology Laboratory , Fundación Hospital General Universitario de Valencia , Valencia , Spain.', 'h Department of Medicine , Universitat de València , Valencia , Spain.', 'i CIBERONC , Valencia , Spain.']"
"['Journal Article', 'Review']",18230576,[Gastrointestinal stromal tumors: molecular aspects and therapeutic implications].,2008 Jan,95,1,107-16,10.1684/bdc.2008.0561 [doi],"Approximately 90 % of gastrointestinal tumors (GISTs) harbor an activating mutation in KIT or PDGFR alpha oncogene known to confer imatinib sensitivity. Imatinib is a tyrosine kinase inhibitor of KIT and PDGFRs that yields a 6-months progression-free survival (PFS) rate of 80 % in patients with advanced GISTs. Several studies have shown that response to imatinib in GIST patients mainly depends on the mutational status of KIT or PDGFR alpha. Moreover, most if not all patients treated with imatinib for advanced GIST will secondarily develop progressive disease under treatment. In the majority of cases, such progressions are the result of acquired resistance due to occurrence of secondary C-KIT mutations; especially for GIST with primary exon 11 mutations. Sunitinib is another approved drug and an inhibitor of multiple tyrosine kinases including KIT, PDGFR alpha as well as PDGFR beta and VEGFRs which are associated with angiogenesis. Sunitinib, in phase II and III trials was associated with durable clinical benefit in nearly 25 % of patients with advanced GIST resistant/intolerant to imatinib. Clearly, a better knowledge of the molecular mechanisms underlying the resistance to imatinib as well as the development of a new class of broad-spectrum tyrosine kinase inhibitors may allow in the near future new individualized therapeutic strategies for GISTs patients.","['Italiano A', 'Bui B']","[""Centre Antoine-Lacassagne, Département d'oncologie médicale, Nice, France.""]"
"['Journal Article', 'Research Support, N.I.H., Extramural', 'Review']",20194236,"Narrative review: Thrombocytosis, polycythemia vera, and JAK2 mutations: The phenotypic mimicry of chronic myeloproliferation.",2010 Mar 2,152,5,300-6,10.7326/0003-4819-152-5-201003020-00008 [doi],"The myeloproliferative disorders polycythemia vera, essential thrombocytosis, and primary myelofibrosis are clonal disorders arising in a pluripotent hematopoietic stem cell, causing an unregulated increase in the number of erythrocytes, leukocytes, or platelets, alone or in combination; eventual marrow dominance by the progeny of the involved stem cell; and a tendency to arterial or venous thrombosis, marrow fibrosis, splenomegaly, or transformation to acute leukemia, albeit at widely varying frequencies. The discovery of an activating mutation (V617F) in the gene for JAK2 (Janus kinase 2), a tyrosine kinase utilized by hematopoietic cell receptors for erythropoietin, thrombopoietin, and granulocyte colony-stimulating factor, provided an explanation for the shared clinical features of these 3 disorders. Constitutive JAK2 activation provides a growth and survival advantage to the hematopoietic cells of the affected clone. Because signaling by the mutated kinase utilizes normal pathways, the result is overproduction of morphologically normal blood cells, an often indolent course, and (in essential thrombocytosis) usually a normal life span. Because the erythropoietin, thrombopoietin, and granulocyte colony-stimulating factor receptors are all constitutively activated, polycythemia vera is the potential ultimate clinical phenotype of the JAK2 V617F mutation and, as a corollary, is the most common of the 3 disorders. The number of cells expressing the JAK2 V617F mutation (the allele burden) seems to correlate with the clinical phenotype. Preliminary results of clinical trials with agents that inhibit the mutated kinase indicate a reduction in splenomegaly and alleviation of night sweats, fatigue, and pruritus.",['Spivak JL'],"['Johns Hopkins Medical Institutions, Baltimore, Maryland 21205-2196, USA. jlspivak@jhmi.edu']"
"['Journal Article', 'Review']",22443647,Personalized therapy for non-small cell lung cancer: which drug for which patient?,2011 Winter,23,4,281-90,10.1053/j.semtcvs.2012.01.001 [doi],"The elucidation of the molecular alterations in non-small cell lung cancer (NSCLC) and the development of molecularly targeted agents have permanently shifted NSCLC therapy to a personalized approach. In the metastatic setting, the addition of the anti-vascular endothelial growth factor monoclonal antibody, bevacizumab, to chemotherapy improves overall survival. The oral epidermal growth factor receptor (EGFR) tyrosine kinase inhibitors, gefitinib and erlotinib, prolong progression-free survival in patients selected for the presence of an EGFR activating mutation. The monoclonal antibody to EGFR, cetuximab, improves survival in patients with metastatic NSCLC, and the inhibitor of the echinoderm microtubule-associated protein-like 4-anaplastic lymphoma kinase (EML4-ALK) fusion protein, crizotinib, has resulted in an unprecedented overall survival advantage in patients harboring the EML4-ALK translocation. In the adjuvant setting, gefitinib has not been shown to improve patient survival outcomes; however, there are several ongoing clinical trials in the adjuvant setting evaluating the role of erlotinib, bevacizumab, and the MAGE-A3 and MUC1 vaccines. The realm of personalized lung cancer therapy also includes the study of chemotherapy selected on the basis of the pharmacogenetic profile of a patient's tumor. Several ongoing clinical trials in both the metastatic and adjuvant settings are studying the excision repair cross-complementing group 1 (ERCC1) protein, the ribonucleotide reductase subunit 1 (RRM1) protein, thymidylate synthase, and BRCA1 as predictors of chemotherapy response. This review will outline the current state of the art of personalized NSCLC therapy.","['Villaruz LC', 'Socinski MA']","['Division of Hematology/Oncology, Department of Medicine, University of Pittsburgh Cancer Institute, Pittsburgh, Pennsylvania 15232 USA.villaruzl@upmc.edu']"
"['Journal Article', ""Research Support, Non-U.S. Gov't"", 'Review']",23562214,Molecular determinants of trastuzumab efficacy: What is their clinical relevance?,2013 Dec,39,8,925-34,S0305-7372(13)00039-X [pii] 10.1016/j.ctrv.2013.02.006 [doi],"Trastuzumab-containing therapy is a standard of care for human epidermal growth factor receptor-2 (HER2)-positive breast cancer. In pre-clinical models, a wide range of molecular mechanisms have been associated with reduced sensitivity to trastuzumab in vitro. These include expression of the truncated HER2 receptor fragment p95HER2, activating mutation of the gene encoding the class 1A catalytic subunit of phosphatidylinositol 3-kinase (PIK3CA), loss of phosphatase and tensin homolog (PTEN), activation of other downstream signal transducers, prevention of cell cycle arrest, increased signaling through alternative (HER or non-HER) tyrosine kinase receptors, and resistance to antibody-dependent cellular cytotoxicity. However, the clinical significance of these mechanisms as determinants of trastuzumab efficacy in vivo has been unclear. Here, we review clinical studies of potential predictive biomarkers of trastuzumab efficacy in HER2-positive breast cancer and consider whether evaluation of such markers might inform patient selection for therapy. We find that clinical evidence relating to potential predictive biomarkers is mostly limited to small, retrospective studies, many of which have yielded conflicting findings. Some trends are evident in the retrospective data and in biomarker analyses from randomized clinical trials, particularly relating to activation of the phosphatidylinositol 3-kinase pathway, but none is sufficiently strong to form a basis for patient selection. This may be explained by the fact that multiple mechanisms of action determine the clinical efficacy of trastuzumab. In the absence of novel, validated biomarkers of efficacy, trastuzumab eligibility should continue to be based on evaluation of HER2 status according to standard methods.","['De P', 'Hasmann M', 'Leyland-Jones B']","['Edith Sanford Breast Cancer Center, Sanford Research/USD, Sioux Falls, SD, USA. Electronic address: pradip.de@sanfordhealth.org.']"
"['Journal Article', 'Review']",20361266,Molecular response prediction in gastrointestinal stromal tumors.,2010 Mar,5,1,29-37,10.1007/s11523-010-0134-9 [doi],"Gastrointestinal stromal tumors (GISTs) are rare tumors of mesenchymal origin that develop along the gastrointestinal tract. Over ten years ago, their management dramatically changed following the discovery of an activating mutation of the KIT oncogene, which led to the use of small molecule inhibitors to therapeutically target these mutant kinases. Patients with advanced GIST, who were once a subset of sarcoma with poor prognosis due to their lack of chemosensitivity, may now survive more than 5 years following treatment with tyrosine kinase inhibitors (TKI) such as imatinib mesylate (IM) and sunitinib malate (SU). After ten years of active clinical and preclinical research, it has become clear that, although relatively homogeneous compared to other solid malignancies, there is still some heterogeneity in GISTs and most notably in regard to response to therapy. Here, we review the current data regarding molecular prediction of response in this disease.","['Cassier PA', 'Blay JY']","['Département de Médecine, Centre Léon Bérard, Lyon, France.']"
"['Journal Article', 'Review']",21656352,Overcoming metastatic melanoma with BRAF inhibitors.,2011 May,34,5,699-701,10.1007/s12272-011-0521-5 [doi],"Melanoma has the capacity to spread via the blood stream to the brain, and has been notoriously resistant to drug therapy. An activating mutation in the gene encoding BRAF is known to be responsible for half of melanomas. This article provides a review of GSK2118436 and PLX4032 as potential therapeutics for the treatment of melanomas by inhibiting oncogenic BRAF.","['Hong S', 'Hong S', 'Han SB']","['Department of Chemistry, Korea Advanced Institute of Science and Technology, Daejeon 305-701, Korea.']"
"['Comparative Study', 'Journal Article', ""Research Support, Non-U.S. Gov't"", 'Review']",28578586,Origin of Somatic Mutations in β-Catenin versus Adenomatous Polyposis Coli in Colon Cancer: Random Mutagenesis in Animal Models versus Nonrandom Mutagenesis in Humans.,2017 Jul 17,30,7,1369-1375,10.1021/acs.chemrestox.7b00092 [doi],"Wnt signaling is compromised early in the development of human colorectal cancer (CRC) due to truncating nonsense mutations in adenomatous polyposis coli (APC). CRC induced by chemical carcinogens, such as heterocyclic aromatic amines and azoxymethane, in mice also involves dysregulation of Wnt signaling but via activating missense mutations in the β-catenin oncogene despite the fact that genetically modified mice harboring an inactive APC allele efficiently develop CRC. In contrast, activating mutations in β-catenin are rarely observed in human CRC. Dysregulation of the Wnt signaling pathway by the two distinct mechanisms reveals insights into the etiology of human CRC. On the basis of calculations related to DNA adduct levels produced in mouse CRC models using mutagens, and the number of stem cells in the mouse colon, we show that two nonsense mutations required for biallelic disruption of APC are statistically unlikely to produce CRC in experiments using small numbers of mice. We calculate that an activating mutation in one allele near the critical GSK3β phosphorylation site on β-catenin is >10(5)-times more likely to produce CRC by random mutagenesis due to chemicals than inactivating two alleles in APC, yet it does not occur in humans. Therefore, the mutagenesis mechanism in human CRC cannot be random. We explain that nonsense APC mutations predominate in human CRC because of deamination at 5-methylcytosine at CGA and CAG codons, coupled with the number of human colonic stem cells and lifespan. Our analyses, including a comparison of mutation type and age at CRC diagnosis in U.S. and Chinese patients, also indicate that APC mutations in CRC are not due to environmental mutagens that randomly damage DNA.","['Yang D', 'Zhang M', 'Gold B']","['Department of Pharmaceutical Sciences, University of Pittsburgh , Pittsburgh, Pennsylvania 15261, United States.', 'Department of Pharmaceutical Sciences, University of Pittsburgh , Pittsburgh, Pennsylvania 15261, United States.', 'Department of Pharmaceutical Sciences, University of Pittsburgh , Pittsburgh, Pennsylvania 15261, United States.']"
"['Journal Article', 'Review']",33307872,New insights into the clinical management of advanced gastrointestinal stromal tumors.,2021 Mar,22,4,439-447,10.1080/14656566.2020.1828346 [doi],"INTRODUCTION: 90% of gastrointestinal stromal tumors (GISTs) harbor an activating mutation in the KIT or PDGFRα oncogene, and these are known to confer imatinib sensitivity. AREAS COVERED: The author reviews the data regarding the current management of GIST, mechanisms of resistance to imatinib, and new drugs currently in clinical development and provides his unique perspectives on the subject matter. EXPERT OPINION: Several studies have shown that the response to imatinib in GIST patients mainly depends on the mutational status of KIT or PDGFRα. Moreover, most, if not all, patients treated with imatinib for advanced GIST will develop a secondary progressive disease under the treatment. In most cases, such progressions are the result of acquired resistance due to the occurrence of secondary c-KIT mutations, especially in GISTs with primary exon 11 mutations. Sunitinib and regorafenib are inhibitors of multiple tyrosine kinases, including KIT, PDGFRα, PDGFRβ, and VEGFRs, and are approved for the management of imatinib- and imatinib/sunitinib-refractory GIST patients, respectively. Clearly, better knowledge of the molecular mechanisms underlying the resistance to imatinib as well as the development of a new class of broad-spectrum tyrosine kinase inhibitors such as avapritinib and ripretinib will provide new individualized therapeutic strategies for GIST patients.",['Italiano A'],"['Department of Medicine, Bergonié Institute, Bordeaux.']"
"['Journal Article', 'Review']",28359250,Insight into Discovery of Next Generation Reversible TMLR Inhibitors Targeting EGFR Activating and Drug Resistant T790M Mutants.,2017,17,7,617-636,10.2174/1568009617666170330112842 [doi],"BACKGROUND: Epidermal growth factor receptor (EGFR) is a well-recognised drug target exploited for treating non-small cell lung cancer (NSCLC). Gefitinib and erlotinib are first generation clinically employed inhibitors used against EGFR activating mutants. However, during course of treatment these inhibitors become ineffective due to the emergence of an acquired secondary mutation. Subsequently, in order to overcome non-responsiveness second and third generation inhibitors were designed having covalent bond and irreversible mode of action. However, these inhibitors were shown to be toxic. This led to the discovery of lead candidates with completely different mode of action and therapeutic efficacy. OBJECTIVE: We have reviewed the recent efforts undertaken by researchers in discovering newer noncovalent reversible next generation inhibitors for treating NSCLC. METHODS: We first studied the optimization steps and pharmacokinetic variables of the synthesised molecules. We also analysed bonds and interactions using PDB X-ray crystal structures as well as scaffold and selectivity analysis was undertaken. RESULTS: We identified that ligand lipophilic efficiency driven potency is a preferable optimisation parameter for maintaining drug likeliness of the molecule. Also, few h-bonds were recognised as major players in affecting the binding of compound. The scaffold analysis revealed that ligand molecules with pyrimidine core exhibit higher inhibitory activity against TMLR, as well as higher selectivity with respect to other kinases. CONCLUSION: Next generation reversible inhibitors exhibited unique binding mode and were found to occupy three major pockets (ribose pocket, back pocket and hinge region), which is critical for increasing the selectivity of the compound against TMLR mutants.","['Agarwal SM', 'Pal D', 'Gupta M', 'Saini R']","['Bioinformatics Division, ICMR-Institute of Cytology and Preventive Oncology, I-7, Sector-39, Noida-201301. India.', 'Bioinformatics Division, ICMR-Institute of Cytology and Preventive Oncology, I-7, Sector-39, Noida-201301. India.', 'Bioinformatics Division, ICMR-Institute of Cytology and Preventive Oncology, I-7, Sector-39, Noida-201301. India.', 'Bioinformatics Division, ICMR-Institute of Cytology and Preventive Oncology, I-7, Sector-39, Noida-201301. India.']"
