Article_type,PMID,Title,DP,Volume,Issue,Page,Doi,Abstract,Author,Affiliation
"['Journal Article', 'Review']",28126187,Sturge-Weber Syndrome: A Review.,2017 Jun,108,5,407-417,S0001-7310(16)30442-2 [pii] 10.1016/j.ad.2016.09.022 [doi],"Sturge-Weber syndrome is a sporadic congenital neurocutaneous disorder caused by a somatic activating mutation in GNAQ; it affects 1 in every 20,000 to 50,000 newborns. It is characterized by a facial Port-wine stain, leptomeningeal angiomatosis, and glaucoma. Seizures are the most common neurological manifestation and typically present in the first months of life. Glaucoma may be present at birth or develop later. Neuroimaging studies show leptomeningeal angiomatosis, supporting diagnosis. Standard treatment for Sturge-Weber syndrome includes laser treatment for the Port-wine stain, anticonvulsants, and medical or surgical treatment for the glaucoma. Prognosis depends on the extent of leptomeningeal involvement and the severity of the glaucoma.","['Higueros E', 'Roe E', 'Granell E', 'Baselga E']","['Servicio de Dermatología, Hospital Santa Creu i Sant Pau, Barcelona, España.', 'Servicio de Dermatología, Hospital Santa Creu i Sant Pau, Barcelona, España.', 'Servicio de Radiología, Hospital Santa Creu i Sant Pau, Barcelona, España.', 'Servicio de Dermatología, Hospital Santa Creu i Sant Pau, Barcelona, España. Electronic address: dra.baselga@gmail.com.']"
"['Journal Article', 'Research Support, N.I.H., Intramural', 'Review']",24262698,Mastocytosis.,2014 Feb,34,1,181-96,S0889-8561(13)00064-7 [pii] 10.1016/j.iac.2013.09.001 [doi],"Mastocytosis is a disorder of abnormal mast cell proliferation, with clinical features that include flushing, pruritus, abdominal pain, diarrhea, hypotension, syncope, and musculoskeletal pain. These features are the result of mast cell mediator release and infiltration into target organs. Patients of all ages may be affected, although in children, manifestations primarily involve the skin. Most patients with systemic disease have a somatically acquired activating mutation in the KIT oncogene. This article discusses the causes and pathogenesis of mastocytosis, with an overview of the clinical features and the approach to diagnosis, evaluation, and therapy in adults and pediatric patients.","['Carter MC', 'Metcalfe DD', 'Komarow HD']","['Laboratory of Allergic Diseases, National Institute of Allergy and Infectious Diseases, National Institutes of Health, 10 Center Drive, Bethesda, MD 20892, USA.']"
"['Journal Article', 'Review']",29220298,Gastrointestinal Stromal Tumors.,2018 Jan 10,36,2,136-143,10.1200/JCO.2017.74.9705 [doi],"GI stromal tumors (GISTs) are neoplasms with a varying malignancy potential ranging from virtually indolent tumors to rapidly progressing cancers. GISTs occur throughout the intestinal tract, and most harbor an activating mutation in either KIT or platelet-derived growth factor A ( PDGFRA). Diagnosis is made using immunohistochemistry, but molecular testing with mutation analysis is paramount for selection of appropriate therapy. Most small GISTs are cured with surgery. Tyrosine kinase inhibitor (TKI) therapy has led to substantial improvements in survival, both for patients with localized GIST and those with advanced disease. Adjuvant therapy with imatinib benefits patients with a high risk of recurrence, with studies suggesting most benefit with at least 3 years of therapy. Neoadjuvant imatinib therapy should be considered for patients requiring extensive surgery, aiming at shrinking the tumor to allow organ preservation and less extensive surgery. The following three TKIs have been approved for the management of advanced disease: imatinib, sunitinib, and regorafenib; imatinib is usually the best tolerated of the three and the standard first-line treatment. TKIs benefit the majority of patients with advanced GIST but have no or limited efficacy in patients with the PDGFRA D842V mutation or patients with GIST lacking KIT and PDGFRA mutations. Surgery, the mainstay of primary tumor management, also plays a role in the advanced disease setting for selected patients, as do some other approaches such as palliative radiation therapy. Research continues to identify novel therapies, in particular effective agents to treat TKI-refractory disease.","['von Mehren M', 'Joensuu H']","['Margaret von Mehren, Fox Chase Cancer Center, Philadelphia, PA; and Heikki Joensuu, Helsinki University Hospital and University of Helsinki, Helsinki, Finland.', 'Margaret von Mehren, Fox Chase Cancer Center, Philadelphia, PA; and Heikki Joensuu, Helsinki University Hospital and University of Helsinki, Helsinki, Finland.']"
"['Journal Article', 'Review']",32107533,Erdheim-Chester disease.,2020 Apr 16,135,16,1311-1318,10.1182/blood.2019002766 [doi],"Erdheim-Chester disease (ECD) is characterized by the infiltration of tissues by foamy CD68+CD1a- histiocytes, with 1500 known cases since 1930. Mutations activating the MAPK pathway are found in more than 80% of patients with ECD, mainly the BRAFV600E activating mutation in 57% to 70% of cases, followed by MAP2K1 in close to 20%. The discovery of BRAF mutations and of other MAP kinase pathway alterations, as well as the co-occurrence of ECD with LCH in 15% of patients with ECD, led to the 2016 revision of the classification of histiocytoses in which LCH and ECD belong to the ""L"" group. Both conditions are considered inflammatory myeloid neoplasms. Ten percent of ECD cases are associated with myeloproliferative neoplasms and/or myelodysplastic syndromes. Some of the most striking signs of ECD are the long bone involvement (80%-95%), as well as the hairy kidney appearance on computed tomography scan (63%), the coated aorta (40%), and the right atrium pseudo-tumoral infiltration (36%). Central nervous system involvement is a strong prognostic factor and independent predictor of death. Interferon-α seems to be the best initial treatment of ECD. Since 2012, more than 200 patients worldwide with multisystem or refractory ECD have benefitted from highly effective therapy with BRAF and MEK inhibitors. Targeted therapies have an overall, robust, and reproducible efficacy in ECD, with no acquired resistance to date, but their use may be best reserved for the most severe manifestations of the disease, as they may be associated with serious adverse effects and as-yet-unknown long-term consequences.","['Haroche J', 'Cohen-Aubart F', 'Amoura Z']","['Sorbonne Université, Assistance Publique-Hôpitaux de Paris, Service de Médecine Interne 2, Maladies Auto-Imunes et Systémiques, Centre National de Référence des Histiocytoses, Hôpital Pitié-Salpêtrière, Paris, France.', 'Sorbonne Université, Assistance Publique-Hôpitaux de Paris, Service de Médecine Interne 2, Maladies Auto-Imunes et Systémiques, Centre National de Référence des Histiocytoses, Hôpital Pitié-Salpêtrière, Paris, France.', 'Sorbonne Université, Assistance Publique-Hôpitaux de Paris, Service de Médecine Interne 2, Maladies Auto-Imunes et Systémiques, Centre National de Référence des Histiocytoses, Hôpital Pitié-Salpêtrière, Paris, France.']"
"['Journal Article', ""Research Support, Non-U.S. Gov't"", 'Review']",31859349,Efficacy of PI3K inhibitors in advanced breast cancer.,2019 Dec 1,30,Suppl_10,x12-x20,10.1093/annonc/mdz381 [doi],"The phosphoinositide 3 (PI3)-kinase/Akt signaling pathway has always been a focus of interest in breast cancer due to its role in cell growth, cell proliferation, cell migration and deregulated apoptosis. Its activation has been linked to endocrine resistance and worse prognosis in certain subgroups of breast cancer. In addition, deregulation of the PI3K/Akt pathway including PIK3CA activating mutation is frequently present in breast cancer. Multiple efforts have been carried out to target this pathway, initially with pan-PI3K inhibitors with some hint of activity but hampered by their limiting side-effects. A recent large randomized trial in patients with endocrine-resistant PIK3CA-mutant hormone receptor (HR)-positive tumors led to the approval of the first PI3K inhibitor, alpelisib, in combination with fulvestrant. The specificity of alpelisib against the p110α catalytic isoform provided additional efficacy and a better toxicity profile. In this review, we summarize the main research with PI3K inhibitors in breast cancer and we provide some insight of potential future combinations of this treatment in breast cancer patients.","['Verret B', 'Cortes J', 'Bachelot T', 'Andre F', 'Arnedos M']","['Medical Oncology Department, Gustave Roussy Cancer Campus, Villejuif, France.', 'IOB Institute of Oncology, Quiron, Madrid & Barcelona.', ""Department of Medical Oncology, Vall d'Hebron Institute of Oncology (VHIO), Barcelona."", 'Medica Scientia Innovation Research (MedSIR), Valencia, Spain.', 'Medica Scientia Innovation Research (MedSIR), New York, USA.', 'Medical Oncology Department, Centre Léon Bérard, Lyon.', 'Medical Oncology Department, Gustave Roussy Cancer Campus, Villejuif, France.', 'Inserm Unit U981, Gustave Roussy Cancer Campus, Villejuif.', 'Université Paris Sud, Paris-Saclay, France.', 'Medical Oncology Department, Gustave Roussy Cancer Campus, Villejuif, France.', 'Inserm Unit U981, Gustave Roussy Cancer Campus, Villejuif.']"
"['Journal Article', 'Review']",31292359,Treatment of Non-small Cell Lung Cancer with EGFR-mutations.,2019,41,2,153-163,10.7888/juoeh.41.153 [doi],"The discovery of activating mutations in the epidermal growth factor receptor (EGFR) gene and development of tyrosine kinase inhibitors (TKIs) of EGFR have achieved a paradigm shift in treatment strategy of non-small cell lung cancer (NSCLC). For advanced NSCLC harboring activating EGFR mutations, an EGFR-TKI is preferably prescribed as it provides a superior survival benefit over platinum-based chemotherapy. To further improve the therapeutic outcomes, more potent EGFR-TKIs through irreversible inhibition of tyrosine kinase have been developed. In a recent clinical trial, an irreversible EGFR-TKI (osimertinib) showed a superior survival benefit with lower toxicity profile. In addition, combination treatments such as an EGFR-TKI plus platinum-based chemotherapy may achieve a long-term survival. For earlier-stage resectable NSCLC with EGFR-mutations, several clinical trials to assess the efficacy of EGFR-TKIs in pre-operative induction setting and in postoperative adjuvant setting are now ongoing. Here we review and discuss the current status and future perspectives of treatment for EGFR-mutated NSCLC.","['Yoneda K', 'Imanishi N', 'Ichiki Y', 'Tanaka F']","['Second Department of Surgery (Chest Surgery), School of Medicine, University of Occupational and Environmental Health, Japan.', 'Second Department of Surgery (Chest Surgery), School of Medicine, University of Occupational and Environmental Health, Japan.', 'Second Department of Surgery (Chest Surgery), School of Medicine, University of Occupational and Environmental Health, Japan.', 'Second Department of Surgery (Chest Surgery), School of Medicine, University of Occupational and Environmental Health, Japan.']"
"['Journal Article', 'Review']",23623056,Gastrointestinal stromal tumour.,2013 Sep 14,382,9896,973-83,S0140-6736(13)60106-3 [pii] 10.1016/S0140-6736(13)60106-3 [doi],"Gastrointestinal stromal tumours (GISTs) are mesenchymal neoplasms that arise in the gastrointestinal tract, usually in the stomach or the small intestine and rarely elsewhere in the abdomen. They can occur at any age, the median age being 60-65 years, and typically cause bleeding, anaemia, and pain. GISTs have variable malignant potential, ranging from small lesions with a benign behaviour to fatal sarcomas. Most tumours stain positively for the mast/stem cell growth factor receptor KIT and anoctamin 1 and harbour a kinase-activating mutation in either KIT or PDGFRA. Tumours without such mutations could have alterations in genes of the succinate dehydrogenase complex or in BRAF, or rarely RAS family genes. About 60% of patients are cured by surgery. Adjuvant treatment with imatinib is recommended for patients with a substantial risk of recurrence, if the tumour has an imatinib-sensitive mutation. Tyrosine kinase inhibitors substantially improve survival in advanced disease, but secondary drug resistance is common.","['Joensuu H', 'Hohenberger P', 'Corless CL']","['Department of Oncology, Helsinki University Central Hospital, Helsinki, Finland. heikki.joensuu@hus.fi']"
"['Journal Article', ""Research Support, Non-U.S. Gov't"", 'Review']",31227004,MET inhibitors for targeted therapy of EGFR TKI-resistant lung cancer.,2019 Jun 21,12,1,63,10.1186/s13045-019-0759-9 [doi] 63,"Treatment of non-small cell lung cancer (NSCLC) harboring epidermal growth factor receptor (EGFR) activating mutation with EGFR-TKIs has achieved great success, yet faces the development of acquired resistance as the major obstacle to long-term disease remission in the clinic. MET (or c-MET) gene amplification has long been known as an important resistance mechanism to first- or second-generation EGFR-TKIs in addition to the appearance of T790 M mutation. Recent preclinical and clinical studies have suggested that MET amplification and/or protein hyperactivation is likely to be a key mechanism underlying acquired resistance to third-generation EGFR-TKIs such as osimertinib as well, particularly when used as a first-line therapy. EGFR-mutant NSCLCs that have relapsed from first-generation EGFR-TKI treatment and have MET amplification and/or protein hyperactivation should be insensitive to osimertinib monotherapy. Therefore, combinatorial therapy with osimertinib and a MET or even a MEK inhibitor should be considered for these patients with resistant NSCLC carrying MET amplification and/or protein hyperactivation.","['Wang Q', 'Yang S', 'Wang K', 'Sun SY']","['Department of Internal Medicine, The Affiliated Cancer Hospital of Zhengzhou University, Henan Cancer Hospital, Zhengzhou, China. qimingwang1006@126.com.', 'Department of Internal Medicine, The Affiliated Cancer Hospital of Zhengzhou University, Henan Cancer Hospital, Zhengzhou, China.', 'Department of Respiratory Medicine, Second Affiliated Hospital, Zhejiang University School of Medicine, Hangzhou, China.', 'Department of Hematology and Medical Oncology, School of Medicine and Winship Cancer Institute, Emory University, 1365-C Clifton Road, C3088, Atlanta, GA, 30322, USA. ssun@emory.edu.']"
"['Journal Article', 'Review']",32409005,Rare causes of hypoglycemia in adults.,2020 Jun,81,2-3,110-117,S0003-4266(20)30058-5 [pii] 10.1016/j.ando.2020.04.003 [doi],"Hypoglycemia is defined by a low blood glucose level associated to clinical symptoms. Hypoglycemia may be related to treatment of diabetes, but also to drugs, alcohol, critical illness, cortisol insufficiency including hypopituitarism, insulinoma, bariatric or gastric surgery, pancreas transplantation or glucagon deficiency, or may be surreptitious. Some hypoglycemic episodes remain unexplained, and genetic, paraneoplastic and immune causes should be considered. Genetic causes may be related to endogenous hyperinsulinism and to inborn errors of metabolism (IEM). Endogenous hyperinsulinism is related to monogenic congenital hyperinsulinism, and especially to mutations of the glucokinase-activating gene or of insulin receptors, both characterised by postprandial hypoglycemia with major hyperinsulinism. In adulthood, IEM-related hypoglycemia can persist in a previously diagnosed childhood disease or may be a presenting sign. It is suggested by systemic involvement (rhabdomyolysis after fasting or exercising, heart disease, hepatomegaly), sometimes associated to a family history of hypoglycemia. The timing of hypoglycemic episodes with respect to the last meal also helps to orientate diagnosis. Fasting hypoglycemia may be related to type 0, I or III glycogen synthesis disorder, fatty acid oxidation or gluconeogenesis disorder. Postprandial hypoglycemia may be related to inherited fructose intolerance. Exercise-induced hyperinsulinism is mainly related to activating mutation of the SLC16A1 gene. Besides exceptional ectopic insulin secretion, paraneoplastic causes involve NICTH (Non-Islet-Cell Tumour Hypoglycemia), caused by Big-IGF2 secretion by a large tumour, with low blood levels of insulin, C-peptide and IGF1. Autoimmune causes involve antibodies against insulin (HIRATA syndrome), especially in case of Graves' disease, or against the insulin receptor. Medical history, timing, and insulin level orientate the diagnosis.","['Douillard C', 'Jannin A', 'Vantyghem MC']","['Endocrinology, diabetology, metabolism department, Lille university hospital, Lille, France; Lille reference centre of inborn errors of metabolism, Lille, France. Electronic address: claire.douillard@chru-lille.fr.', 'Endocrinology, diabetology, metabolism department, Lille university hospital, Lille, France. Electronic address: arnaud.jannin.aj@gmail.com.', 'Endocrinology, diabetology, metabolism department, Lille university hospital, Lille, France; Inserm U1190 translational research in diabetes, Lille, France; European genomic institute for diabetes EGID, Lille, France. Electronic address: mc-vantyghem@chru-lille.fr.']"
"['Journal Article', 'Review']",27426476,CLOVES syndrome: review of a PIK3CA-related overgrowth spectrum (PROS).,2017 Jan,91,1,14-21,10.1111/cge.12832 [doi],"Overgrowth syndromes are characterized by global or localized disproportionate growth associated with other anomalies, including vascular malformations and neurological and/or visceral disorders. CLOVES (Congenital Lipomatous asymmetric Overgrowth of the trunk with lymphatic, capillary, venous, and combined-type Vascular malformations, Epidermal naevi, Scoliosis/Skeletal and spinal anomalies) is an overgrowth syndrome caused by mosaic activating mutation in gene PIK3CA, which gives rise to abnormal PI3K-AKT-mTOR pathway activation. These mutations are responsible for the clinical manifestations of the syndrome, which include low- and high-flow vascular malformations, thoracic lipomatous hyperplasia, asymmetric growth, and visceral and neurological disorders. These common anomalies are illustrated with figures from two personal cases. Identification of the clinical and genetic characteristics of CLOVES syndrome is crucial for the differential diagnosis with other overgrowth syndromes, such as Proteus or Klippel-Trenaunay (K-T) syndromes, and for the therapeutic management of the different anomalies. In this context, a new entity comprising different syndromes with phenotypic mutations in PIK3CA has been proposed, designated PIK3CA-related overgrowth spectrum (PROS), with the aim of facilitating clinical management and establishing appropriate genetic study criteria.","['Martinez-Lopez A', 'Blasco-Morente G', 'Perez-Lopez I', 'Herrera-Garcia JD', 'Luque-Valenzuela M', 'Sanchez-Cano D', 'Lopez-Gutierrez JC', 'Ruiz-Villaverde R', 'Tercedor-Sanchez J']","['Dermatology Unit, Complejo Hospitalario Universitario, Granada, Spain.', 'Dermatology Unit, Complejo Hospitalario Universitario, Granada, Spain.', 'Dermatology Unit, Complejo Hospitalario Universitario, Granada, Spain.', 'Neurological Unit, Complejo Hospitalario Universitario, Granada, Spain.', 'Orthopedical Unit, Complejo Hospitalario Universitario, Granada, Spain.', 'Internal Medicine Unit, Complejo Hospitalario Universitario, Granada, Spain.', 'Vascular Malformations Unit, Hospital Infantil La Paz, Madrid, Spain.', 'Dermatology Unit, Complejo Hospitalario Universitario, Granada, Spain.', 'Dermatology Unit, Complejo Hospitalario Universitario, Granada, Spain.']"
"['Journal Article', ""Research Support, Non-U.S. Gov't"", 'Review']",26199389,Molecular Pathways: Targeting the CXCR4-CXCL12 Axis--Untapped Potential in the Tumor Microenvironment.,2015 Oct 1,21,19,4278-85,10.1158/1078-0432.CCR-14-0914 [doi],"Evidence suggests that the CXC-chemokine receptor-4 pathway plays a role in cancer cell homing and metastasis, and thus represents a potential target for cancer therapy. The homeostatic microenvironment chemokine CXCL12 binds the CXCR4 and CXCR7 receptors, activating divergent signals on multiple pathways, such as ERK1/2, p38, SAPK/JNK, AKT, mTOR, and the Bruton tyrosine kinase (BTK). An activating mutation in CXCR4 is responsible for a rare disease, WHIM syndrome (warts, hypogammaglobulinemia, infections, and myelokathexis), and dominant CXCR4 mutations have also been reported in Waldenstrom macroglobulinemia. The CXCR4-CXCL12 axis regulates the hematopoietic stem cell niche--a property that has led to the approval of the CXCR4 antagonist plerixafor (AMD3100) for mobilization of hematopoietic precursors. In preclinical models, plerixafor has shown antimetastatic potential in vivo, offering proof of concept. Other antagonists are in preclinical and clinical development. Recent evidence demonstrates that inhibiting CXCR4 signaling restores sensitivity to CTLA-4 and PD-1 checkpoint inhibitors, creating a new line for investigation. Targeting the CXCR4-CXCL12 axis thus offers the possibility of affecting CXCR4-expressing primary tumor cells, modulating the immune response, or synergizing with other targeted anticancer therapies.",['Scala S'],"['Molecular Immunology, Functional Genomics, Istituto Nazionale per lo Studio e la Cura dei Tumori, ""Fondazione G. Pascale,"" IRCCS, Napoli, Italy. s.scala@istitutotumori.na.it scalaste@gmail.com.']"
"['Journal Article', 'Review']",28214977,BRAF-Mutated Colorectal Cancer: What Is the Optimal Strategy for Treatment?,2017 Feb,18,2,9,10.1007/s11864-017-0453-5 [doi],"The BRAF activating mutation, harbored by approximately 10% of colorectal cancers (CRC), confers dramatic prognosis to advanced diseases. In early-stage setting, the identification of the BRAF mutation does not impact the therapeutic decision. Yet, the BRAF mutation could be considered as a stratification factor in adjuvant trials, because of its prognostic impact after relapse. Moreover, both BRAF mutation and mismatch repair (MMR) statuses should be determined in all CRC to help identify sporadic tumors versus Lynch syndrome-related tumors. Indeed, in patients with MMR-deficient (dMMR) tumors and MLH1 loss of expression, the BRAFV600E mutation indicates a sporadic origin. In advanced BRAF-mutated CRC, the standard of care remains fluoropyrimidine-based cytotoxic regimen in combination with bevacizumab. Although a recent meta-analysis showed that there was insufficient data to justify the exclusion of anti-EGFR monoclonal antibodies, antiangiogenic agents should be preferred in the first-line setting. Despite the lack of a randomized phase 3 study dedicated to BRAF-mutated CRC, chemotherapy intensification combining a quadruple association of 5-fluorouracil, oxaliplatin, irinotecan (FOLFOXIRI), and bevacizumab seems like a valid option. Although first results with BRAF inhibitors as single agents in BRAF-mutated CRC were disappointing, their association with therapies targeting the MAPK pathway seems to overcome the primary resistance to BRAF inhibition. In the field of sporadic CRC, the BRAF mutation is strongly associated with MMR deficiency. Considering breakthrough results of immune checkpoint inhibitors in dMMR repair tumors, determination of the MMR status appears to be mandatory. Given the dramatic prognosis conferred by the BRAF mutation, patients with BRAF-mutated advanced CRC need to be systematically identified and proposed for clinical trial enrolment in order to benefit from innovative therapies.","['Cohen R', 'Cervera P', 'Svrcek M', 'Pellat A', 'Dreyer C', 'de Gramont A', 'André T']","['Department of Medical Oncology, Saint-Antoine Hospital, APHP, 184 rue du Faubourg Saint-Antoine, 75012, Paris, France.', 'Department of Pathology, Saint-Antoine Hospital, APHP, 184 rue du Faubourg Saint-Antoine, 75012, Paris, France.', 'Department of Pathology, Saint-Antoine Hospital, APHP, 184 rue du Faubourg Saint-Antoine, 75012, Paris, France.', 'Department of Medical Oncology, Saint-Antoine Hospital, APHP, 184 rue du Faubourg Saint-Antoine, 75012, Paris, France.', 'Department of Medical Oncology, Saint-Antoine Hospital, APHP, 184 rue du Faubourg Saint-Antoine, 75012, Paris, France.', 'Department of Medical Oncology, Institut Hospitalier Franco-Britannique, 4 rue Kléber, 92300, Levallois-Perret, France.', 'GERCOR, Oncology Multidisciplinary Group, 151 rue du Faubourg Saint Antoine, 75011, Paris, France.', 'Department of Medical Oncology, Saint-Antoine Hospital, APHP, 184 rue du Faubourg Saint-Antoine, 75012, Paris, France. thierry.andre@aphp.fr.', 'GERCOR, Oncology Multidisciplinary Group, 151 rue du Faubourg Saint Antoine, 75011, Paris, France. thierry.andre@aphp.fr.']"
